<?xml version="1.0" encoding="UTF-8"?>
<gems xmlns:xsi="http://www.w3.org/2001/XMLSchema-instance"
	xmlns="http://www.example.org/gems"
	xsi:schemaLocation="http://www.example.org/gems gems.xsd">
	<precious-gemstone id="p1">
		<name>Diamond</name>
		<value>20</value>
		<parameters>
			<color>White</color>
			<transparency>0</transparency>
			<number-of-faces>15</number-of-faces>
		</parameters>
		<cut-date>2002-05-30T09:00:00</cut-date>
	</precious-gemstone>
	<semiprecious-gemstone id="s1" origin="Australia">
		<name>Opal</name>
		<value>15</value>
		<parameters>
			<color>Blue</color>
			<transparency>95</transparency>
			<number-of-faces>4</number-of-faces>
		</parameters>
		<cut-date>2012-12-25T12:00:00</cut-date>
	</semiprecious-gemstone>
</gems>